{
  "id": "K2-p0006",
  "domain": "pattern_recognition",
  "age_bands": [
    "K-2"
  ],
  "difficulty": 0,
  "discrimination": 1.6,
  "guessing": 0.25,
  "content": {
    "stem": "Look at the growing pattern. Small box, medium box, large box. What comes next?",
    "type": "size_pattern",
    "options": [
      {
        "text": "extra large box"
      },
      {
        "text": "small box"
      },
      {
        "text": "medium box"
      },
      {
        "text": "large box"
      }
    ],
    "correct_index": 0,
    "explanation": "The boxes are growing bigger each time. After large, the next size up would be extra large to continue the growing pattern."
  },
  "metadata": {
    "cognitive_skill": "progressive pattern recognition",
    "misconception_targeted": "pattern completion versus repetition",
    "bloom_level": "understand",
    "distractor_rationale": [
      {
        "option_index": 1,
        "misconception_id": "cycle_restart",
        "reasoning": "Child thinks the pattern cycles back to the beginning instead of continuing to grow"
      },
      {
        "option_index": 2,
        "misconception_id": "partial_cycle",
        "reasoning": "Child thinks the pattern goes back one step instead of forward"
      },
      {
        "option_index": 3,
        "misconception_id": "static_repetition",
        "reasoning": "Child repeats the last element instead of continuing the progression"
      }
    ]
  }
}