{
  "id": "35-r0032",
  "domain": "reasoning",
  "age_bands": [
    "3-5"
  ],
  "difficulty": -1,
  "discrimination": 1.5,
  "guessing": 0.25,
  "content": {
    "stem": "Which one does NOT belong with the others?",
    "type": "odd_one_out",
    "options": [
      {
        "text": "violin"
      },
      {
        "text": "trumpet"
      },
      {
        "text": "piano"
      },
      {
        "text": "guitar"
      }
    ],
    "correct_index": 1,
    "explanation": "Violin, piano, and guitar all have strings that vibrate to make sound. A trumpet is a brass instrument that makes sound through air vibration in a tube."
  },
  "metadata": {
    "cognitive_skill": "classification and categorization",
    "misconception_targeted": "surface_level_grouping",
    "bloom_level": "analyze",
    "distractor_rationale": [
      {
        "option_index": 0,
        "misconception_id": "size_based_grouping",
        "reasoning": "Students may group by size rather than sound production method"
      },
      {
        "option_index": 2,
        "misconception_id": "keyboard_distinction",
        "reasoning": "Students may see piano as different due to keyboard interface"
      },
      {
        "option_index": 3,
        "misconception_id": "portability_grouping",
        "reasoning": "Students may focus on which instruments are easily portable"
      }
    ]
  }
}