{
  "id": "35-r0026",
  "domain": "reasoning",
  "age_bands": [
    "3-5"
  ],
  "difficulty": 1.4,
  "discrimination": 2,
  "guessing": 0.25,
  "content": {
    "stem": "Library is to books as museum is to ___",
    "type": "analogy",
    "options": [
      {
        "text": "artifacts"
      },
      {
        "text": "visitors"
      },
      {
        "text": "building"
      },
      {
        "text": "education"
      }
    ],
    "correct_index": 0,
    "explanation": "A library is a place that houses and displays books for people to use. Similarly, a museum is a place that houses and displays artifacts for people to view and learn from."
  },
  "metadata": {
    "cognitive_skill": "abstract relational reasoning",
    "misconception_targeted": "function versus content confusion",
    "bloom_level": "analyze",
    "distractor_rationale": [
      {
        "option_index": 1,
        "misconception_id": "agent_focus",
        "reasoning": "Students may focus on who uses the place rather than what it contains"
      },
      {
        "option_index": 2,
        "misconception_id": "physical_structure",
        "reasoning": "Students may focus on the physical aspect rather than the functional relationship"
      },
      {
        "option_index": 3,
        "misconception_id": "purpose_confusion",
        "reasoning": "Students may focus on the abstract purpose rather than the concrete contents"
      }
    ]
  }
}