{
  "id": "35-v0001",
  "domain": "verbal",
  "age_bands": [
    "3-5"
  ],
  "difficulty": -2.1,
  "discrimination": 1.2,
  "guessing": 0.25,
  "content": {
    "stem": "The little girl was very happy when she got her new puppy. Which word could replace 'happy' in this sentence without changing its meaning?",
    "type": "synonym",
    "options": [
      {
        "text": "joyful"
      },
      {
        "text": "excited"
      },
      {
        "text": "surprised"
      },
      {
        "text": "calm"
      }
    ],
    "correct_index": 0,
    "explanation": "Joyful means feeling great happiness or delight, which is the same as being happy. The other words describe different emotions or states."
  },
  "metadata": {
    "cognitive_skill": "vocabulary precision and semantic understanding",
    "misconception_targeted": "confusing related positive emotions as synonyms",
    "bloom_level": "understand",
    "distractor_rationale": [
      {
        "option_index": 1,
        "misconception_id": "emotion_conflation",
        "reasoning": "Students may think excited means the same as happy because both are positive feelings"
      },
      {
        "option_index": 2,
        "misconception_id": "positive_emotion_confusion",
        "reasoning": "Students might confuse surprised as synonymous with happy because surprises can be pleasant"
      },
      {
        "option_index": 3,
        "misconception_id": "mood_state_confusion",
        "reasoning": "Students may think calm and happy are the same because both can be pleasant states"
      }
    ]
  }
}