{
  "id": "35-r0028",
  "domain": "reasoning",
  "age_bands": [
    "3-5"
  ],
  "difficulty": 2.2,
  "discrimination": 1.8,
  "guessing": 0.25,
  "content": {
    "stem": "Find the next number: 2, 5, 11, 23, ___",
    "type": "number_series",
    "options": [
      {
        "text": "35"
      },
      {
        "text": "41"
      },
      {
        "text": "47"
      },
      {
        "text": "50"
      }
    ],
    "correct_index": 2,
    "explanation": "The differences between numbers next to each other are: 5-2=3, 11-5=6, 23-11=12. The differences (3, 6, 12) double each time. The next difference should be 24, so 23+24=47."
  },
  "metadata": {
    "cognitive_skill": "complex pattern recognition",
    "misconception_targeted": "simple arithmetic progression assumption",
    "bloom_level": "analyze",
    "distractor_rationale": [
      {
        "option_index": 0,
        "misconception_id": "constant_difference",
        "reasoning": "Students may assume a constant difference of 12 and get 23+12=35"
      },
      {
        "option_index": 1,
        "misconception_id": "linear_increase",
        "reasoning": "Students may see differences increasing by 6 each time (3,6,12,18) and get 23+18=41"
      },
      {
        "option_index": 3,
        "misconception_id": "round_number_bias",
        "reasoning": "Students may choose a round number that seems reasonable"
      }
    ]
  }
}