{
  "id": "35-r0013",
  "domain": "reasoning",
  "age_bands": [
    "3-5"
  ],
  "difficulty": -1.2,
  "discrimination": 1.8,
  "guessing": 0.25,
  "content": {
    "stem": "What number comes next in this sequence: 4, 8, 12, 16, ___?",
    "type": "number_series",
    "options": [
      {
        "text": "18"
      },
      {
        "text": "20"
      },
      {
        "text": "22"
      },
      {
        "text": "24"
      }
    ],
    "correct_index": 1,
    "explanation": "This sequence increases by 4 each time: 4+4=8, 8+4=12, 12+4=16, so 16+4=20."
  },
  "metadata": {
    "cognitive_skill": "inductive pattern recognition",
    "misconception_targeted": "incorrect_increment",
    "bloom_level": "apply",
    "distractor_rationale": [
      {
        "option_index": 0,
        "misconception_id": "add_two_pattern",
        "reasoning": "Student incorrectly identifies pattern as adding 2 (16+2=18)"
      },
      {
        "option_index": 2,
        "misconception_id": "double_increment",
        "reasoning": "Student adds 6 instead of 4, possibly confusing with another pattern"
      },
      {
        "option_index": 3,
        "misconception_id": "doubling_misconception",
        "reasoning": "Student thinks pattern might involve doubling or sees 24 as 'too big' but plausible"
      }
    ]
  }
}