{
  "id": "K2-v0009",
  "domain": "verbal",
  "age_bands": [
    "K-2"
  ],
  "difficulty": 1.5,
  "discrimination": 1.6,
  "guessing": 0.25,
  "content": {
    "stem": "Lily ate breakfast, then brushed her teeth, then got her backpack. What is Lily doing?",
    "type": "inference",
    "options": [
      {
        "text": "going to bed"
      },
      {
        "text": "getting ready for school"
      },
      {
        "text": "going to play outside"
      },
      {
        "text": "helping mom cook"
      }
    ],
    "correct_index": 1,
    "explanation": "The sequence of eating breakfast, brushing teeth, and getting a backpack shows Lily is following her morning routine to get ready for school."
  },
  "metadata": {
    "cognitive_skill": "sequential reasoning and routine pattern recognition",
    "misconception_targeted": "single-action focus versus sequence analysis",
    "bloom_level": "analyze",
    "distractor_rationale": [
      {
        "option_index": 0,
        "misconception_id": "individual_action_focus",
        "reasoning": "Children might focus only on tooth brushing, which happens at bedtime too"
      },
      {
        "option_index": 2,
        "misconception_id": "backpack_misinterpretation",
        "reasoning": "Students might think backpack means outdoor play rather than school"
      },
      {
        "option_index": 3,
        "misconception_id": "morning_activity_confusion",
        "reasoning": "Breakfast connection might suggest kitchen activity without considering the full sequence"
      }
    ]
  }
}