{
  "id": "35-r0037",
  "domain": "reasoning",
  "age_bands": [
    "3-5"
  ],
  "difficulty": 0.5,
  "discrimination": 1.7,
  "guessing": 0.25,
  "content": {
    "stem": "Which one belongs to a different category: butterfly, eagle, penguin, bat",
    "type": "odd_one_out",
    "options": [
      {
        "text": "butterfly"
      },
      {
        "text": "eagle"
      },
      {
        "text": "penguin"
      },
      {
        "text": "bat"
      }
    ],
    "correct_index": 3,
    "explanation": "Butterfly, eagle, and penguin are all born from eggs, while bats are mammals that give birth to live young. This distinguishes mammals from other animal classes. While penguins do not fly, the classification is based on reproductive method, not flight ability."
  },
  "metadata": {
    "cognitive_skill": "classification and categorization",
    "misconception_targeted": "reproductive_method_vs_flight_grouping",
    "bloom_level": "analyze",
    "distractor_rationale": [
      {
        "option_index": 0,
        "misconception_id": "size_based_exclusion",
        "reasoning": "Students may see butterfly as different due to size"
      },
      {
        "option_index": 1,
        "misconception_id": "predator_distinction",
        "reasoning": "Students may focus on eagles being predators"
      },
      {
        "option_index": 2,
        "misconception_id": "flightless_bird_focus",
        "reasoning": "Students may exclude penguin for not flying, missing the deeper biological classification"
      }
    ]
  }
}