{
  "id": "K2-p0004",
  "domain": "pattern_recognition",
  "age_bands": [
    "K-2"
  ],
  "difficulty": -1,
  "discrimination": 1.5,
  "guessing": 0.25,
  "content": {
    "stem": "What number comes next in this pattern: 1, 3, 2, 4, 3, 5, ___?",
    "type": "number_pattern",
    "options": [
      {
        "text": "4"
      },
      {
        "text": "6"
      },
      {
        "text": "7"
      },
      {
        "text": "5"
      }
    ],
    "correct_index": 0,
    "explanation": "This pattern has two rules working together: odd positions (1st, 3rd, 5th) count up by 1 (1, 2, 3), and even positions (2nd, 4th, 6th) count up by 1 starting from 3 (3, 4, 5). Since the 7th position is odd, it continues the first sequence: 4."
  },
  "metadata": {
    "cognitive_skill": "alternating sequence pattern recognition",
    "misconception_targeted": "single rule pattern assumption",
    "bloom_level": "analyze",
    "distractor_rationale": [
      {
        "option_index": 1,
        "misconception_id": "linear_progression_error",
        "reasoning": "Child focuses only on the even positions (3, 4, 5) and continues that sequence"
      },
      {
        "option_index": 2,
        "misconception_id": "add_constant_error",
        "reasoning": "Child sees 5 as last number and adds 2, thinking there's a consistent +2 pattern"
      },
      {
        "option_index": 3,
        "misconception_id": "repeat_last_error",
        "reasoning": "Child gets confused by dual pattern and repeats the previous odd position number"
      }
    ]
  }
}