{
  "id": "35-r0034",
  "domain": "reasoning",
  "age_bands": [
    "3-5"
  ],
  "difficulty": 1,
  "discrimination": 1.6,
  "guessing": 0.2,
  "content": {
    "stem": "All rectangles have four sides. All squares are rectangles. What is true about squares?",
    "type": "syllogism",
    "options": [
      {
        "text": "All squares have four sides"
      },
      {
        "text": "Some squares have four sides"
      },
      {
        "text": "No squares have four sides"
      },
      {
        "text": "Only some rectangles are squares"
      },
      {
        "text": "All rectangles are squares"
      }
    ],
    "correct_index": 0,
    "explanation": "Since all rectangles have four sides, and all squares are rectangles, then all squares must have four sides. This follows the logical rule that properties of a larger category apply to all members of subcategories."
  },
  "metadata": {
    "cognitive_skill": "deductive reasoning",
    "misconception_targeted": "universal_vs_particular_quantifiers",
    "bloom_level": "analyze",
    "distractor_rationale": [
      {
        "option_index": 1,
        "misconception_id": "quantifier_weakening",
        "reasoning": "Students use 'some' when 'all' is logically required"
      },
      {
        "option_index": 2,
        "misconception_id": "negation_error",
        "reasoning": "Students incorrectly negate universal statements"
      },
      {
        "option_index": 3,
        "misconception_id": "converse_confusion",
        "reasoning": "Students confuse the direction of logical relationships"
      },
      {
        "option_index": 4,
        "misconception_id": "illicit_conversion",
        "reasoning": "Students incorrectly convert 'all squares are rectangles' to 'all rectangles are squares'"
      }
    ]
  }
}