{
  "id": "35-m0001",
  "domain": "math",
  "age_bands": [
    "3-5"
  ],
  "difficulty": -2.1,
  "discrimination": 1.2,
  "guessing": 0.25,
  "content": {
    "stem": "Maria bakes 24 muffins and puts them equally into 4 boxes. How many muffins are in each box?",
    "type": "word_problem",
    "options": [
      {
        "text": "6 muffins"
      },
      {
        "text": "8 muffins"
      },
      {
        "text": "20 muffins"
      },
      {
        "text": "28 muffins"
      }
    ],
    "correct_index": 0,
    "explanation": "To find how many muffins go in each box, divide the total (24) by the number of boxes (4): 24 ÷ 4 = 6 muffins per box."
  },
  "metadata": {
    "cognitive_skill": "Division reasoning in equal groups context",
    "misconception_targeted": "Basic division word problem interpretation",
    "bloom_level": "apply",
    "distractor_rationale": [
      {
        "option_index": 1,
        "misconception_id": "multiplication_instead_of_division",
        "reasoning": "Student multiplies 4 × 2 thinking about pairs of boxes"
      },
      {
        "option_index": 2,
        "misconception_id": "subtraction_instead_of_division",
        "reasoning": "Student subtracts boxes from total: 24 - 4 = 20"
      },
      {
        "option_index": 3,
        "misconception_id": "addition_instead_of_division",
        "reasoning": "Student adds total and boxes: 24 + 4 = 28"
      }
    ]
  }
}