{
  "id": "68-r0004",
  "domain": "reasoning",
  "age_bands": [
    "6-8"
  ],
  "difficulty": 1.2,
  "discrimination": 1.8,
  "guessing": 0.25,
  "content": {
    "stem": "In a 3×3 matrix, the first row shows: circle, square, triangle. The second row shows: filled circle, filled square, filled triangle. What should appear in the bottom-right position if the third row starts with: striped circle, striped square, ___?",
    "type": "matrix",
    "options": [
      {
        "text": "striped triangle"
      },
      {
        "text": "triangle"
      },
      {
        "text": "filled triangle"
      },
      {
        "text": "striped circle"
      }
    ],
    "correct_index": 0,
    "explanation": "The matrix follows two rules: columns maintain the same shape (circle, square, triangle) while rows maintain the same pattern (outline, filled, striped). The intersection of the triangle column and striped row must be a striped triangle."
  },
  "metadata": {
    "cognitive_skill": "simultaneous relational reasoning across two dimensions",
    "misconception_targeted": "single-dimension focus in matrices",
    "bloom_level": "analyze",
    "distractor_rationale": [
      {
        "option_index": 1,
        "misconception_id": "ignore_pattern",
        "reasoning": "Students focus only on shape progression, ignoring the fill pattern"
      },
      {
        "option_index": 2,
        "misconception_id": "wrong_pattern",
        "reasoning": "Students apply the filled pattern from row 2 instead of the striped pattern from row 3"
      },
      {
        "option_index": 3,
        "misconception_id": "shape_confusion",
        "reasoning": "Students continue the shape pattern from the row instead of maintaining column consistency"
      }
    ]
  }
}