{
  "id": "35-r0044",
  "domain": "reasoning",
  "age_bands": [
    "3-5"
  ],
  "difficulty": 0.2,
  "discrimination": 1.6,
  "guessing": 0.25,
  "content": {
    "stem": "All dogs have four legs. Max is a dog. Some dogs are brown. What must be true about Max?",
    "type": "syllogism",
    "options": [
      {
        "text": "Max has four legs"
      },
      {
        "text": "Max is brown"
      },
      {
        "text": "Max is a good pet"
      },
      {
        "text": "Max likes to run"
      }
    ],
    "correct_index": 0,
    "explanation": "Since all dogs have four legs and Max is a dog, Max must have four legs. This follows logically from the given statements."
  },
  "metadata": {
    "cognitive_skill": "deductive reasoning",
    "misconception_targeted": "possible vs necessary confusion",
    "bloom_level": "apply",
    "distractor_rationale": [
      {
        "option_index": 1,
        "misconception_id": "some_means_all",
        "reasoning": "Students confuse 'some dogs are brown' with 'all dogs are brown'"
      },
      {
        "option_index": 2,
        "misconception_id": "assumption_addition",
        "reasoning": "Students add assumptions not given in the premises"
      },
      {
        "option_index": 3,
        "misconception_id": "assumption_addition",
        "reasoning": "Students make inferences based on general knowledge rather than logical deduction"
      }
    ]
  }
}