{
  "id": "35-r0008",
  "domain": "reasoning",
  "age_bands": [
    "3-5"
  ],
  "difficulty": 2,
  "discrimination": 2,
  "guessing": 0.25,
  "content": {
    "stem": "Some flowers are roses. All roses are plants. Which statement must be true?",
    "type": "syllogism",
    "options": [
      {
        "text": "Some flowers are plants"
      },
      {
        "text": "All flowers are plants"
      },
      {
        "text": "All plants are flowers"
      },
      {
        "text": "Some plants are roses"
      }
    ],
    "correct_index": 0,
    "explanation": "Since some flowers are roses, and all roses are plants, we know that at least some flowers (the ones that are roses) must be plants. We cannot conclude that ALL flowers are plants from the given information."
  },
  "metadata": {
    "cognitive_skill": "quantified logical reasoning with 'some' and 'all'",
    "misconception_targeted": "confusing 'some' and 'all' quantifiers in logical reasoning",
    "bloom_level": "analyze",
    "distractor_rationale": [
      {
        "option_index": 1,
        "misconception_id": "quantifier_strengthening",
        "reasoning": "Student incorrectly strengthens 'some flowers are roses' to conclude about ALL flowers"
      },
      {
        "option_index": 2,
        "misconception_id": "logical_reversal",
        "reasoning": "Student reverses the logical relationship, thinking 'all roses are plants' means 'all plants are roses'"
      },
      {
        "option_index": 3,
        "misconception_id": "premise_restatement",
        "reasoning": "Student restates part of the given information rather than drawing a new conclusion"
      }
    ]
  }
}