{
  "id": "35-r0005",
  "domain": "reasoning",
  "age_bands": [
    "3-5"
  ],
  "difficulty": 0,
  "discrimination": 1.4,
  "guessing": 0.25,
  "content": {
    "stem": "What number should replace the ? in this pattern: 2, 4, 6, ?, 10",
    "type": "number_series",
    "options": [
      {
        "text": "7"
      },
      {
        "text": "8"
      },
      {
        "text": "9"
      },
      {
        "text": "12"
      }
    ],
    "correct_index": 1,
    "explanation": "The pattern counts by 2s: 2, 4, 6, 8, 10. The missing number is 8."
  },
  "metadata": {
    "cognitive_skill": "sequential pattern completion",
    "misconception_targeted": "skip counting vs consecutive counting",
    "bloom_level": "apply",
    "distractor_rationale": [
      {
        "option_index": 0,
        "misconception_id": "consecutive_adding",
        "reasoning": "Students may add 1 to the previous number instead of recognizing +2 pattern"
      },
      {
        "option_index": 2,
        "misconception_id": "average_thinking",
        "reasoning": "Students may think 9 is halfway between 6 and 10"
      },
      {
        "option_index": 3,
        "misconception_id": "doubling_error",
        "reasoning": "Students may think the pattern involves doubling from 6 to 12"
      }
    ]
  }
}