{
  "id": "68-p0005",
  "domain": "pattern_recognition",
  "age_bands": [
    "6-8"
  ],
  "difficulty": 1.8,
  "discrimination": 1.6,
  "guessing": 0.25,
  "content": {
    "stem": "In this size pattern, objects grow according to a geometric progression: 2mm, 6mm, 18mm, 54mm, ?, 486mm. What is the missing measurement?",
    "type": "size_pattern",
    "options": [
      {
        "text": "162mm"
      },
      {
        "text": "108mm"
      },
      {
        "text": "216mm"
      },
      {
        "text": "324mm"
      }
    ],
    "correct_index": 0,
    "explanation": "Each measurement is multiplied by 3: 2×3=6, 6×3=18, 18×3=54, 54×3=162, 162×3=486. The missing measurement is 162mm."
  },
  "metadata": {
    "cognitive_skill": "geometric progression recognition with verification constraint",
    "misconception_targeted": "arithmetic vs geometric progression confusion",
    "bloom_level": "analyze",
    "distractor_rationale": [
      {
        "option_index": 1,
        "misconception_id": "doubling_pattern",
        "reasoning": "Student doubles 54 to get 108, not recognizing the ×3 pattern"
      },
      {
        "option_index": 2,
        "misconception_id": "additive_thinking",
        "reasoning": "Student adds a constant difference and chooses 216 based on arithmetic reasoning"
      },
      {
        "option_index": 3,
        "misconception_id": "multiplication_error",
        "reasoning": "Student multiplies by 6 instead of 3, getting 54×6=324"
      }
    ]
  }
}