{
  "id": "35-r0043",
  "domain": "reasoning",
  "age_bands": [
    "3-5"
  ],
  "difficulty": -0.5,
  "discrimination": 1.8,
  "guessing": 0.25,
  "content": {
    "stem": "What number comes next: 4, 8, 12, 16, ___",
    "type": "number_series",
    "options": [
      {
        "text": "18"
      },
      {
        "text": "20"
      },
      {
        "text": "24"
      },
      {
        "text": "32"
      }
    ],
    "correct_index": 1,
    "explanation": "The pattern increases by 4 each time (4+4=8, 8+4=12, 12+4=16), so 16+4=20."
  },
  "metadata": {
    "cognitive_skill": "pattern recognition and inductive reasoning",
    "misconception_targeted": "incorrect pattern identification",
    "bloom_level": "apply",
    "distractor_rationale": [
      {
        "option_index": 0,
        "misconception_id": "addition_error",
        "reasoning": "Students might add 2 instead of 4, or make an arithmetic mistake"
      },
      {
        "option_index": 2,
        "misconception_id": "doubling_pattern",
        "reasoning": "Students might think the pattern is doubling and add 8 instead of 4"
      },
      {
        "option_index": 3,
        "misconception_id": "multiplication_confusion",
        "reasoning": "Students might think the pattern involves doubling the previous number"
      }
    ]
  }
}